{
  "$schema": "http://json-schema.org/draft-07/schema#",
  "title": "warehouse-sync SyncConfig",
  "description": "Declarative definition of one source-table → warehouse-table replication job.",
  "type": "object",
  "required": ["name", "sync_id", "version", "source", "mode", "warehouse", "schedule"],
  "additionalProperties": false,
  "properties": {
    "name": {
      "type": "string",
      "description": "Human-readable name (used in logs and UI)."
    },
    "sync_id": {
      "type": "string",
      "pattern": "^[a-z][a-z0-9_]*$",
      "description": "Stable identifier — used as PK in state store. snake_case."
    },
    "version": {
      "type": "string",
      "pattern": "^[0-9]+\\.[0-9]+\\.[0-9]+$",
      "description": "SemVer of this config. Bump on schema-relevant changes."
    },
    "description": { "type": "string" },

    "source": {
      "type": "object",
      "required": ["type", "table"],
      "properties": {
        "type": {
          "type": "string",
          "description": "Source type discriminator — resolved via ServiceLoader. Built-in: postgres, mysql (stub), debezium-kafka (stub)."
        },
        "connection": {
          "type": "object",
          "description": "Connection params. Prefer *_env fields so secrets never live in config files.",
          "additionalProperties": true
        },
        "schema": { "type": "string", "description": "Source schema/database name." },
        "table": { "type": "string", "description": "Source table name." },
        "columns": {
          "type": "array",
          "items": { "type": "string" },
          "description": "Whitelist of columns to sync. Empty/missing = all columns."
        },
        "primary_key": {
          "type": "array",
          "items": { "type": "string" },
          "description": "Ordered PK columns. Required for merge mode."
        },
        "incremental_column": {
          "type": "string",
          "description": "Column used as the watermark (e.g. updated_at, id). Required for append_only + merge; ignored for full_replace."
        },
        "incremental_column_type": {
          "type": "string",
          "enum": ["timestamp", "long", "int", "date", "string"],
          "description": "Wire type of the incremental column. Determines watermark comparison + storage."
        }
      },
      "additionalProperties": true
    },

    "mode": {
      "type": "string",
      "enum": ["append_only", "merge", "full_replace"],
      "description": "Write mode. append_only = each batch is appended; merge = Iceberg MERGE INTO on PK; full_replace = stage to temp table then swap."
    },

    "warehouse": {
      "type": "object",
      "required": ["table_name"],
      "properties": {
        "table_name": {
          "type": "string",
          "description": "Fully-qualified warehouse table (namespace.table). Created if it does not exist."
        },
        "target_catalog": {
          "type": "string",
          "default": "iceberg",
          "description": "Spark catalog name (matches spark.sql.catalog.<name>)."
        },
        "partition_by": {
          "type": "array",
          "items": { "type": "string" },
          "description": "Partition columns for the Iceberg table."
        },
        "sort_by": {
          "type": "array",
          "items": { "type": "string" },
          "description": "Sort-order columns for the Iceberg table."
        }
      },
      "additionalProperties": false
    },

    "schedule": {
      "type": "object",
      "required": ["cadence", "batch_size"],
      "properties": {
        "cadence": {
          "type": "string",
          "pattern": "^[0-9]+(s|m|h|d)$",
          "description": "Duration string ('30s', '5m', '1h'). Consumed by `serve` daemon; ignored by one-shot `run`."
        },
        "batch_size": {
          "type": "integer",
          "minimum": 1,
          "description": "Max rows per LIMIT clause. Runs loop until fewer than batch_size rows returned."
        },
        "full_refresh_cadence": {
          "type": "string",
          "pattern": "^[0-9]+(s|m|h|d)$",
          "description": "Optional: how often to run a full-replace snapshot even on merge/append tables (catches deletes)."
        },
        "watermark_lag_seconds": {
          "type": "integer",
          "minimum": 0,
          "default": 0,
          "description": "For timestamp watermarks: don't read rows younger than N seconds (avoid racing in-flight commits)."
        }
      },
      "additionalProperties": false
    },

    "fields": {
      "type": "array",
      "description": "Optional per-column overrides (rename, retype).",
      "items": {
        "type": "object",
        "required": ["name"],
        "properties": {
          "name": { "type": "string", "description": "Source column name." },
          "warehouse_name": { "type": "string", "description": "Override name in target." },
          "type": { "type": "string", "description": "Override the auto-detected Iceberg type." },
          "description": { "type": "string" }
        }
      }
    }
  }
}
